{
  "schema_version": "1.0",
  "message_type": "owner_decision",
  "created_at": "2026-07-18T10:03:00Z",
  "safety_flags": {
    "synthetic_local_only": true,
    "mock_only": true,
    "dry_run": true,
    "owner_review_required": true,
    "external_side_effects_allowed": false,
    "external_side_effects_occurred": false,
    "blackboard_write_allowed": false,
    "queue_write_allowed": false,
    "audit_trail_write_allowed": false,
    "worker_dispatch_allowed": false,
    "openclaw_call_allowed": false,
    "hermes_runtime_allowed": false,
    "connector_call_allowed": false,
    "google_sheets_write_allowed": false,
    "follow_up_allowed": false,
    "follow_up_requires_owner_confirmation": true
  },
  "prev_entry_hash": "cccccccccccccccccccccccccccccccccccccccccccccccccccccccccccccccc",
  "execution_class": "AUTO",
  "produced_by": "owner-decision-preview",
  "parent_task_id": null,
  "role": "owner",
  "decision_id": "decision-phase3-001",
  "task_id": "task-phase3-001",
  "readiness_id": "readiness-phase3-001",
  "related_audit_id": null,
  "decision_status": "PASS",
  "decided_at": "2026-07-18T10:03:00Z",
  "decision_reason": "Permit the synthetic dry-run preview only.",
  "action_available": false,
  "next_step_allowed": true,
  "next_step_requires_owner_confirmation": true
}
